OSPEDALE CIVILE REGINA MONTIS REGALIS - ASL CN1, Laboratorio Analisi ,"Via S. Rocchetto, 99 Mondovì - CN ", 0174677212 Referente: Dott. Mario Sola ,,, ,07:00,10:00,07:00,10:00,07:00,10:00,07:00,10:00,07:00,10:00,,,Uniti contro l'AIDS,https://www.uniticontrolaids.it/aids-ist/test/dove.aspx, Dati aggiornati al 12/01/2021 ,,,,,,,,,,,,,,,,,,,,,,,,,,,,,,,,,,,,,,,,,,,,,,,,,,,,,,,,,,,,,,,,,,,,,,,,,,,,,,,,,,,,,,,,,,,,,,,,,,,,
ASL CN 1 - AZIENDA OSPEDALIERA OSPEDALE CIVILE DI SALUZZO, Laboratorio Analisi Cliniche ,"Via Spielberg, 58 Saluzzo - CN ", 0175/215213 ,,, ,07:00,15:00,07:00,15:00,07:00,15:00,07:00,15:00,07:00,15:00,,,Uniti contro l'AIDS,https://www.uniticontrolaids.it/aids-ist/test/dove.aspx, Dati aggiornati al 25/03/2019 ,,,,,,,,,,,,,,,,,,,,,,,,,,,,,,,,,,,,,,,,,,,,,,,,,,,,,,,,,,,,,,,,,,,,,,,,,,,,,,,,,,,,,,,,,,,,,,,,,,,,
CENTRO PRELIEVI," Via S.Carlo, 2 Arona - NO ",, 0322516280 ,,, ,08:00,09:00,08:00,09:00,08:00,09:00,08:00,09:00,08:00,09:00,,,Uniti contro l'AIDS,https://www.uniticontrolaids.it/aids-ist/test/dove.aspx, Dati aggiornati al 25/03/2019 ,,,,,,,,,,,,,,,,,,,,,,,,,,,,,,,,,,,,,,,,,,,,,,,,,,,,,,,,,,,,,,,,,,,,,,,,,,,,,,,,,,,,,,,,,,,,,,,,,,,,
OSPEDALE SS.TRINITA', Centro Prelievi ,"Via Monsignor Cavigioli, 5 Borgomanero - NO ",,,, ,,,10:00,11:00,10:00,11:00,10:00,11:00,,,,,Uniti contro l'AIDS,https://www.uniticontrolaids.it/aids-ist/test/dove.aspx, Dati aggiornati al 17/12/2020 ,,,,,,,,,,,,,,,,,,,,,,,,,,,,,,,,,,,,,,,,,,,,,,,,,,,,,,,,,,,,,,,,,,,,,,,,,,,,,,,,,,,,,,,,,,,,,,,,,,,,
AZIENDA OSPEDALIERA UNIVERSITARIA OSPEDALE MAGGIORE DELLA CARITA'," Struttura Complessa Malattie Infettive Corso G. Mazzini, 18 Novara - NO ",, 0321 3733257 ,,, ,08:00,12:00,08:00,12:00,08:00,12:00,08:00,12:00,08:00,12:00,,,Uniti contro l'AIDS,https://www.uniticontrolaids.it/aids-ist/test/dove.aspx, Dati aggiornati al 16/11/2020 ,,,,,,,,,,,,,,,,,,,,,,,,,,,,,,,,,,,,,,,,,,,,,,,,,,,,,,,,,,,,,,,,,,,,,,,,,,,,,,,,,,,,,,,,,,,,,,,,,,,,
AZIENDA OSPEDALIERO UNIVERSITARIA OSPEDALE MAGGIORE DELLA CARITA'," Centro Malattie Sessualmente Trasmesse Clinica Dermatologica - pad. G sottopiano Corso Mazzini, 18 Novara - NO ",, 03213733251/ 03213733334 Referente: Dott.ssa Pamela Farinelli ,,, ,,,,,08:00,12:00,,,,,,,Uniti contro l'AIDS,https://www.uniticontrolaids.it/aids-ist/test/dove.aspx, Dati aggiornati al 22/06/2019 ,,,"verrà effettuato un numero massimo di 5 prime visite, presentarsi dalle 8 alle 9",,,,,,,,,,,,,,,,,,,,,,,,,,,,,,,,,,,,,,,,,,,,,,,,,,,,,,,,,,,,,,,,,,,,,,,,,,,,,,,,,,,,,,,,,,,,,,,,,
AZIENDA SANITARIA NOVARA, Settore Igiene Pubblica - Centro Prelievi ,Via Rugiada 20 Trecate - NO , 0321/786608 , 0321/786604 Referente: Dott. Raffaele Buttafava ,, ,08:10,09:00,su prenotazione,,su prenotazione,,su prenotazione,,su prenotazione,,,,Uniti contro l'AIDS,https://www.uniticontrolaids.it/aids-ist/test/dove.aspx, Dati aggiornati al 14/03/2019 ,su prenotazione,,,,,,,,,,,,,,,,,,,,,,,,,,,,,,,,,,,,,,,,,,,,,,,,,,,,,,,,,,,,,,,,,,,,,,,,,,,,,,,,,,,,,,,,,,,,,,,,,,,
AZIENDA OSPEDALIERA ASL TO 5 OSPEDALE MAGGIORE, Laboratorio Analisi Cliniche ,"P.zza Silvio Pellico, 1 Chieri - TO ", 01194293402 ,,, ,07:00,09:00,07:00,09:00,07:00,09:00,07:00,09:00,07:00,09:00,,,Uniti contro l'AIDS,https://www.uniticontrolaids.it/aids-ist/test/dove.aspx, Dati aggiornati al 06/05/2019 ,,,,,,,,,,,,,,,,,,,,,,,,,,,,,,,,,,,,,,,,,,,,,,,,,,,,,,,,,,,,,,,,,,,,,,,,,,,,,,,,,,,,,,,,,,,,,,,,,,,,
ASL TO4 - OSPEDALE CIVILE DI CIRIE', Laboratorio Analisi Cliniche ,"Via Battitore, 2/4 Ciriè - TO ", 0119217270 Referente: Dott. Enrico Bo ,,, ,07:30,09:30,07:30,09:30,07:30,09:30,07:30,09:30,07:30,09:30,,,Uniti contro l'AIDS,https://www.uniticontrolaids.it/aids-ist/test/dove.aspx, Dati aggiornati al 18/06/2019 ,,,,,,,,,,,,,,,,,,,,,,,,,,,,,,,,,,,,,,,,,,,,,,,,,,,,,,,,,,,,,,,,,,,,,,,,,,,,,,,,,,,,,,,,,,,,,,,,,,,,
ASL TO4, Laboratorio Analisi ,"Piazza Mussatti, 5 Cuorgnè - TO ", 0124654214 , 0124654260 Referente: Dott. Nicolò Zammataro ,, ,08:00,09:00,08:00,09:00,08:00,09:00,08:00,09:00,08:00,09:00,,,Uniti contro l'AIDS,https://www.uniticontrolaids.it/aids-ist/test/dove.aspx, Dati aggiornati al 16/12/2020 ,,,,,,,,,,,,,,,,,,,,,,,,,,,,,,,,,,,,,,,,,,,,,,,,,,,,,,,,,,,,,,,,,,,,,,,,,,,,,,,,,,,,,,,,,,,,,,,,,,,,
ASL TO4 - CENTRO PRELIEVI POLIAMBULATORIO GASSINO, Poliambulatorio ,"Via Foratella, 22 Gassino Torinese - TO ", 0119176666 ,,, ,07:45,09:30,07:45,09:30,07:45,09:30,07:45,09:30,07:45,09:30,,,Uniti contro l'AIDS,https://www.uniticontrolaids.it/aids-ist/test/dove.aspx, Dati aggiornati al 10/12/2019 ,,,,,,,,,,,,,,,,,,,,,,,,,,,,,,,,,,,,,,,,,,,,,,,,,,,,,,,,,,,,,,,,,,,,,,,,,,,,,,,,,,,,,,,,,,,,,,,,,,,,
ASL TO4 OSPEDALE CIVILE, Settore Immunologia - Laboratorio Analisi ,"P.zza Credenza, 2 Ivrea - TO ", 0125414235 , 0125414344 Referente: Dott.ssa Giliola Crotti ,, ,08:30,12:00,08:30,12:00,08:30,12:00,08:30,12:00,08:30,12:00,,,Uniti contro l'AIDS,https://www.uniticontrolaids.it/aids-ist/test/dove.aspx, Dati aggiornati al 17/07/2017 ,,,,,,,,,,,,,,,,,,,,,,,,,,,,,,,,,,,,,,,,,,,,,,,,,,,,,,,,,,,,,,,,,,,,,,,,,,,,,,,,,,,,,,,,,,,,,,,,,,,,
ASL TO4 PRESIDIO OSPEDALIERO LANZO-TORINESE, Laboratorio Analisi Cliniche ,"Via Marchese della Rocca, 30 Lanzo Torinese - TO ", 0123300626 Referente: Dott. Enrico Bo ,,, ,07:30,09:30,07:30,09:30,07:30,09:30,07:30,09:30,07:30,09:30,,,Uniti contro l'AIDS,https://www.uniticontrolaids.it/aids-ist/test/dove.aspx, Dati aggiornati al 01/08/2017 ,,,,,,,,,,,,,,,,,,,,,,,,,,,,,,,,,,,,,,,,,,,,,,,,,,,,,,,,,,,,,,,,,,,,,,,,,,,,,,,,,,,,,,,,,,,,,,,,,,,,
PRESIDIO OSPEDALIERO ASL TO5 DISTRETTO MONCALIERI, Laboratorio Analisi ,"Via Vittime di Bologna, 20 Moncalieri - TO ", 011 6824307 ,,, ,07:30,09:00,07:30,09:00,07:30,09:00,07:30,09:00,07:30,09:00,,,Uniti contro l'AIDS,https://www.uniticontrolaids.it/aids-ist/test/dove.aspx, Dati aggiornati al 14/03/2019 ,,,,,,,,,,,,,,,,,,,,,,,,,,,,,,,,,,,,,,,,,,,,,,,,,,,,,,,,,,,,,,,,,,,,,,,,,,,,,,,,,,,,,,,,,,,,,,,,,,,,
AZIENDA OSPEDALIERA UNIVERSITARIA OSPEDALE S. LUIGI GONZAGA," Struttura Complessa a Direzione Ospedaliera di Patologia Clinica- Laboratorio Analisi Cliniche e Microbiologia Regione Gònzole, 10 Orbassano - TO ",, 011/90266894 , 011/9026629 Referente: Dott.ssa Silvana Gonella ,, ,08:00,10:00,08:00,10:00,08:00,10:00,08:00,10:00,08:00,10:00,,,Uniti contro l'AIDS,https://www.uniticontrolaids.it/aids-ist/test/dove.aspx, Dati aggiornati al 23/06/2017 ,,,,,,,,,,,,,,,,,,,,,,,,,,,,,,,,,,,,,,,,,,,,,,,,,,,,,,,,,,,,,,,,,,,,,,,,,,,,,,,,,,,,,,,,,,,,,,,,,,,,
ASL TO3 - OSPEDALE EDOARDO AGNELLI, Laboratorio Analisi ,"Via Brigata Cagliari, 39 Pinerolo - TO ", 0121233380 , 0121233034 ,, ,08:00,16:00,08:00,16:00,08:00,16:00,08:00,16:00,08:00,16:00,,,Uniti contro l'AIDS,https://www.uniticontrolaids.it/aids-ist/test/dove.aspx, Dati aggiornati al 25/03/2019 ,,,,,,,,,,,,,,,,,,,,,,,,,,,,,,,,,,,,,,,,,,,,,,,,,,,,,,,,,,,,,,,,,,,,,,,,,,,,,,,,,,,,,,,,,,,,,,,,,,,,
ASL TO3, laboratorio analisi ,Via Rivalta 29 Rivoli - TO , 011/9551203 , 0119551390 ,, ,08:00,16:00,08:00,16:00,08:00,16:00,08:00,16:00,08:00,16:00,,,Uniti contro l'AIDS,https://www.uniticontrolaids.it/aids-ist/test/dove.aspx, Dati aggiornati al 25/03/2019 ,,,,,,,,,,,,,,,,,,,,,,,,,,,,,,,,,,,,,,,,,,,,,,,,,,,,,,,,,,,,,,,,,,,,,,,,,,,,,,,,,,,,,,,,,,,,,,,,,,,,
ASL TO4 DISTRETTO DI SETTIMO TORINESE, Laboratorio Analisi ,"Via Leini, 70 Settimo Torinese - TO Referente: Dott.ssa Claudia Torlai ",,,, ,07:30,09:45,07:30,09:45,07:30,09:45,07:30,09:45,07:30,09:45,,,Uniti contro l'AIDS,https://www.uniticontrolaids.it/aids-ist/test/dove.aspx, Dati aggiornati al 04/11/2020 ,con prenotazione,con prenotazione,con prenotazione,con prenotazione,con prenotazione,,,,,,,,,,,,,,,,,,,,,,,,,,,,,,,,,,,,,,,,,,,,,,,,,,,,,,,,,,,,,,,,,,,,,,,,,,,,,,,,,,,,,,,,,,,,,,,
ASL TO3, Laboratorio Analisi C.so Inghilterra 66 Susa - TO ,, 0122621304 Referente: Dott.ssa Favro Fulvia ,,, ,08:00,16:00,08:00,16:00,08:00,16:00,08:00,16:00,08:00,16:00,,,Uniti contro l'AIDS,https://www.uniticontrolaids.it/aids-ist/test/dove.aspx, Dati aggiornati al 25/03/2019 ,,,,,,,,,,,,,,,,,,,,,,,,,,,,,,,,,,,,,,,,,,,,,,,,,,,,,,,,,,,,,,,,,,,,,,,,,,,,,,,,,,,,,,,,,,,,,,,,,,,,
ASL TO3 COLLEGNO," Laboratorio Analisi Cliniche C.so Inghilterra, 66 Susa - TO ",, 0122621383 Referente: Dott. Fulvia Favro ,,, ,08:00,09:15,08:00,09:15,08:00,09:15,08:00,09:15,08:00,09:15,,,Uniti contro l'AIDS,https://www.uniticontrolaids.it/aids-ist/test/dove.aspx, Dati aggiornati al 14/03/2019 ,Accesso diretto,Accesso diretto,Accesso diretto,Accesso diretto,Accesso diretto,,,,,,,,,,,,,,,,,,,,,,,,,,,,,,,,,,,,,,,,,,,,,,,,,,,,,,,,,,,,,,,,,,,,,,,,,,,,,,,,,,,,,,,,,,,,,,,
AOU CITTA DELLA SALUTE E DELLA SCIENZA DI TORINO," Centro Prelievi Sede Molinette C.so Bramante, 88/90 Torino - TO ",, 011/6334751 ,,, ,07:30,10:00,07:30,10:00,07:30,10:00,07:30,10:00,07:30,10:00,,,Uniti contro l'AIDS,https://www.uniticontrolaids.it/aids-ist/test/dove.aspx, Dati aggiornati al 08/03/2019 ,"senza impegnativa, consuling,acquisizione del consenso","s senza impegnativa, consuling,acquisizione del consenso","ssenza impegnativa, consuling,acquisizione del consenso","ssenza impegnativa, consuling,acquisizione del consenso","ssenza impegnativa, consuling,acquisizione del consenso",,,,,,,,,,,,,,,,,,,,,,,,,,,,,,,,,,,,,,,,,,,,,,,,,,,,,,,,,,,,,,,,,,,,,,,,,,,,,,,,,,,,,,,,,,,,,,,
ASL TO1 - OSPEDALE MARTINI, Laboratorio Analisi Chimica e Microbiologia ,"Via Tofane, 71 Torino - TO ", 01170952296 , 011/10 95 24 56 ,, ,07:45,10:30,07:45,10:30,07:45,10:30,07:45,10:30,07:45,10:30,,,Uniti contro l'AIDS,https://www.uniticontrolaids.it/aids-ist/test/dove.aspx, Dati aggiornati al 10/04/2019 ,,,,,,,,,,,,,,,,,,,,,,,,,,,,,,,,,,,,,,,,,,,,,,,,,,,,,,,,,,,,,,,,,,,,,,,,,,,,,,,,,,,,,,,,,,,,,,,,,,,,
ASL TO2 OSPEDALE AMEDEO DI SAVOIA," Ambulatori centralizzati - Padiglione E C.so Svizzera, 164 Torino - TO ",, 0114393916 ,,, ,07:30,14:30,07:30,14:30,07:30,14:30,07:30,14:30,07:30,14:30,08:00,12:00,Uniti contro l'AIDS,https://www.uniticontrolaids.it/aids-ist/test/dove.aspx, Dati aggiornati al 05/03/2018 ,,,,,,,,,,,,,,,,,,,,,,,,,,,,,,,,,,,,,,,,,,,,,,,,,,,,,,,,,,,,,,,,,,,,,,,,,,,,,,,,,,,,,,,,,,,,,,,,,,,,
AUSL TO1 - DISTRETTO 8 -OSPEDALE EVANGELICO VALDESE, Poliambulatorio ,"Via Silvio Pellico, 28 Torino - TO ", 0116540213 Referente: Sig.ra Rosita Panebianco Coord. Inf. ,,, ,07:30,10:00,07:30,10:00,07:30,10:00,07:30,10:00,07:30,10:00,,,Uniti contro l'AIDS,https://www.uniticontrolaids.it/aids-ist/test/dove.aspx, Dati aggiornati al 02/03/2018 ,Accesso diretto,Accesso diretto,Accesso diretto,Accesso diretto,Accesso diretto,,,,,,,,,,,,,,,,,,,,,,,,,,,,,,,,,,,,,,,,,,,,,,,,,,,,,,,,,,,,,,,,,,,,,,,,,,,,,,,,,,,,,,,,,,,,,,,
AZIENDA OSPEDALIERA ORDINE MAURIZIANO," Laboratorio Analisi Chimico Cliniche e Microbiologia L.go Turati, 62 Torino - TO ",, 0115082374-2375 , 0115082668 Referente: Dott.ssa Ines Casonato ,, ,08:00,09:30,08:00,09:30,,,08:00,09:30,,,,,Uniti contro l'AIDS,https://www.uniticontrolaids.it/aids-ist/test/dove.aspx, Dati aggiornati al 17/11/2020 ,con criterio di urgenza fino alle 10.00,,,,,,,,,,,,,,,,,,,,,,,,,,,,,,,,,,,,,,,,,,,,,,,,,,,,,,,08: 00 ,09: 30 ,08: 00 ,09: 30 ,,,,,,,,,,,,,,,,,,,,,,,,,,,,,,,,,,,,,,,,,
Centro Multidisciplinare per la Salute Sessuale, Via Juvarra 19 Torino - TO ,, 0115666064 ,,, ,09:00,10:30,09:00,10:30,09:00,10:00,09:00,10:00,08:30,10:00,,,Uniti contro l'AIDS,https://www.uniticontrolaids.it/aids-ist/test/dove.aspx, Dati aggiornati al 28/12/2020 ,ACCESSO DIRETTO SOSPESO PER COVID ! Servizio di triage telefonico per successivi percorsi solo su prenotazione,ACCESSO DIRETTO SOSPESO PER COVID ! Servizio di triage telefonico per successivi percorsi solo su prenotazione,ACCESSO DIRETTO SOSPESO PER COVID ! Servizio di triage telefonico per successivi percorsi solo su prenotazione,ACCESSO DIRETTO SOSPESO PER COVID ! Servizio di triage telefonico per successivi percorsi solo su prenotazione,Accoglienza pubblico per prenotazione visite e prestazioni,,,,,,,,,,,,,,,,,,,,,,,,,,,,,,,,,,,,,,,,,,,,,,,,,,,,,,,,,,,,,,,,,,,,,,,,,,,,,,,,,,,,,,,,,,,,,,,
DIPARTIMENTO INTEGRATO DI MALATTIE INFETTIVE - OSPEDALE AMEDEO DI SAVOIA," Padiglione E Cottolengo - Ambulatorio Malattie Infettive C.so Svizzera, 164 Torino - TO ",, 0114393794 , 0114393806 Referente: Dott. Gian Carlo Orofino ,, ,07:30,14:00,07:30,14:00,07:30,14:00,07:30,14:00,07:30,14:00,08:00,12:00,Uniti contro l'AIDS,https://www.uniticontrolaids.it/aids-ist/test/dove.aspx, Dati aggiornati al 30/11/2020 ,Accesso diretto,Accesso diretto,Accesso diretto,Accesso diretto,Accesso diretto,Accesso diretto,,,,,,,,,,,,,,,,,,,,,,,,,,,,,,,,,,,,,,,,,,,,,,,,,,,,,,,,,,,,,,,,,,,,,,,,,,,,,,,,,,,,,,,,,,,,,,
OSPEDALE .AMEDEO DI SAVOIA," Malattie Infettive Corso Svizzera, 164 - Padiglione ""E "" primo piano Torino - TO ",, 011 4393794 Referente: Dott.ssa Duilia Mazzuri ,,, ,07:30,14:00,07:30,14:00,07:30,14:00,07:30,14:00,07:30,14:00,08:00,12:00,Uniti contro l'AIDS,https://www.uniticontrolaids.it/aids-ist/test/dove.aspx, Dati aggiornati al 30/01/2018 ,referto in giornata se prelievo effettuato entro le ore 11,referto in giornata se prelievo effettuato entro le ore 11,referto in giornata se prelievo effettuato entro le ore 11,referto in giornata se prelievo effettuato entro le ore 11,referto in giornata se prelievo effettuato entro le ore 11,referto in giornata se prelievo effettuato entro le ore 10,,,,,,,,,,,,,,,,,,,,,,,,,,,,,,,,,,,,,,,,,,,,,,,,,,,,,,,,,,,,,,,,,,,,,,,,,,,,,,,,,,,,,,,,,,,,,,
OSPEDALE AMEDEO DI SAVOIA - MALATTIE INFETTIVE E TROPICALI - DIVISIONE A," Ambulatorio Migrazione e Salute C.so Svizzera, 164 Torino - TO ",, 0114393915 , 0114393977 ,, ,08:30,15:30,08:30,15:30,08:30,12:30,08:30,15:30,08:30,15:30,,,Uniti contro l'AIDS,https://www.uniticontrolaids.it/aids-ist/test/dove.aspx, Dati aggiornati al 24/05/2019 ,al mattino visite solo su appuntamento,mattino solo su appuntamento,,,,,,,,,,,,,,,,,,,,,,,,,,,,,,,,,,,,,,,,,,,,,,,,,,,,,,,,,,,,,,,,,,,,,,,,,,,,,,,,,,,,,,,,,,,,,,,,,,
ASL VCO - (VERBANIA-CUSIO-OSSOLA) OSP. SAN BIAGIO," Laboratorio Analisi Largo Vittime Lager Nazifascisti, 1 Domodossola - VB ",, 0324491294-247 Referente: Dott.ssa Cinzia Rossi ,,, ,07:30,09:30,07:30,09:30,07:30,09:30,07:30,09:30,07:30,09:30,,,Uniti contro l'AIDS,https://www.uniticontrolaids.it/aids-ist/test/dove.aspx, Dati aggiornati al 19/03/2019 ,Accesso diretto,Accesso diretto,Accesso diretto,Accesso diretto,Accesso diretto,,,,,,,,,,,,,,,,,,,,,,,,,,,,,,,,,,,,,,,,,,,,,,,,,,,,,,,,,,,,,,,,,,,,,,,,,,,,,,,,,,,,,,,,,,,,,,,
ASL VCO Laboratorio di Omegna, Laboratorio Analisi Lungolago Bruno Buozzi Omegna - VB ,, 0323868925 Referente: Dott. Nino Cappuccia ,,, ,07:30,10:00,07:30,10:00,07:30,10:00,07:30,10:00,07:30,10:00,,,Uniti contro l'AIDS,https://www.uniticontrolaids.it/aids-ist/test/dove.aspx, Dati aggiornati al 20/02/2018 ,Accesso diretto o con pre. tel al n. 0323868932,Accesso diretto o con pre. tel al n. 0323868932,Accesso diretto o con pre. tel al n. 0323868932,Accesso diretto o con pre. tel al n. 0323868932,Accesso diretto o con pre. tel al n. 0323868932,,,,,,,,,,,,,,,,,,,,,,,,,,,,,,,,,,,,,,,,,,,,,,,,,,,,,,,,,,,,,,,,,,,,,,,,,,,,,,,,,,,,,,,,,,,,,,,
ASL VCO OSPEDALE CASTELLI, Ambulatorio malattie Infettive ,"Via Fiume,18 Verbania - VB ", 0323541329 Referente: Bottari Gaetano ,,, ,08:00,09:30,08:00,09:30,08:00,09:30,08:00,09:30,08:00,09:30,,,Uniti contro l'AIDS,https://www.uniticontrolaids.it/aids-ist/test/dove.aspx, Dati aggiornati al 01/12/2020 ,11:30,14:00,11:30,14:00,,,16:00,,16:00,,,,12:30,12:30,,,,,,,,,,,,,,,,,,,,,,,,,,,,,,,,,,,,,,,,,,,,,,,,,,,,,,,,,,,,,,,,,,,,,,,,,,,,,,,,,,,,,,
"ASL VCO (VERBANIA-CUSIO-OSSOLA) OSPEDALE ""G.CASTELLI """, Laboratorio Analisi ,Via Fiume Verbania - VB , 0323 541238 ,,, ,07:30,09:30,07:30,09:30,07:30,09:30,07:30,09:30,07:30,09:30,,,Uniti contro l'AIDS,https://www.uniticontrolaids.it/aids-ist/test/dove.aspx, Dati aggiornati al 23/06/2017 ,,,,,,,,,,,,,,,,,,,,,,,,,,,,,,,,,,,,,,,,,,,,,,,,,,,,,,,,,,,,,,,,,,,,,,,,,,,,,,,,,,,,,,,,,,,,,,,,,,,,
PRESIDIO OSPEDALIERO DI VERBANIA, Struttura Semplice Dipartimentale di Malattie Infettive ,"Via Fiume, 18 Verbania - VB ", 0323541351- 0323541329 , 0323541368 Referente: Dott. Bottari Gaetano ,, ,08:00,13:00,08:00,12:45,08:00,13:00,08:00,12:45,08:00,13:00,Solo su appuntamento per urgenze,,Uniti contro l'AIDS,https://www.uniticontrolaids.it/aids-ist/test/dove.aspx, Dati aggiornati al 12/02/2020 ,,14:00,,14:00,,,16:00,,16:00,,,,,,,,,,,,,,,,,,,,,,,,,,,,,,,,,,,,,,,,,,,,,,,,,,,,,,,,,,,,,,,,,,,,,,,,,,,,,,,,,,,,,,,,,,,
OSPEDALE SANTISSIMI PIETRO E PAOLO ASL VC, Laboratorio analisi ,"Via Ilorini Mo, 1 Borgosesia - VC ", 0163426492 ,,, ,08:00,15:00,08:00,15:00,08:00,15:00,08:00,15:00,08:00,15:00,,,Uniti contro l'AIDS,https://www.uniticontrolaids.it/aids-ist/test/dove.aspx, Dati aggiornati al 13/09/2017 ,,,,,,,,,,,,,,,,,,,,,,,,,,,,,,,,,,,,,,,,,,,,,,,,,,,,,,,,,,,,,,,,,,,,,,,,,,,,,,,,,,,,,,,,,,,,,,,,,,,,
CASA DELLA SALUTE - GATTINARA," Centro prelievi C.so Vercelli, 159 Gattinara - VC ",, 0163-822386/252 ,,, ,08:00,09:15,08:00,09:15,08:00,09:15,08:00,09:15,08:00,08:15,,,Uniti contro l'AIDS,https://www.uniticontrolaids.it/aids-ist/test/dove.aspx, Dati aggiornati al 06/05/2019 ,,,,,,,,,,,,,,,,,,,,,,,,,,,,,,,,,,,,,,,,,,,,,,,,,,,,,,,,,,,,,,,,,,,,,,,,,,,,,,,,,,,,,,,,,,,,,,,,,,,,
ASL VC - OSPEDALE S. ANDREA," Ambulatorio Malattie Infettive Corso Mario Abbiate, 21 Vercelli - VC ",, 0161593516 , 0161593291 Referente: Dott.ssa Maria Esposito ,, ,08:00,15:00,08:00,15:00,08:00,15:00,08:00,15:00,08:00,15:00,,,Uniti contro l'AIDS,https://www.uniticontrolaids.it/aids-ist/test/dove.aspx, Dati aggiornati al 26/09/2019 ,,,,,,,,,,,,,,,,,,,,,,,,,,,,,,,,,,,,,,,,,,,,,,,,,,,,,,,,,,,,,,,,,,,,,,,,,,,,,,,,,,,,,,,,,,,,,,,,,,,,
ASL VC OSPEDALE S. ANDREA," Laboratorio Analisi Corso Mario Abbiate, 21 Vercelli - VC ",, 0161-593512 Referente: Dott.ssa Micaela Pelagi ,,, ,08:00,09:15,08:00,09:15,08:00,09:15,08:00,09:15,08:00,09:15,,,Uniti contro l'AIDS,https://www.uniticontrolaids.it/aids-ist/test/dove.aspx, Dati aggiornati al 04/03/2019 ,,,,,,,,,,,,,,,,,,,,,,,,,,,,,,,,,,,,,,,,,,,,,,,,,,,,,,,,,,,,,,,,,,,,,,,,,,,,,,,,,,,,,,,,,,,,,,,,,,,,
OSPEDALE GENERALE REGIONALE MIULLI - ENTE ECCLESISTICO - UOC DI PATOLOGIA CLINICA, Laboratorio Analisi ,Via Provinciale Acquaviva per Santeramo in Colle Km 4.100 Acquaviva delle Fonti - BA , 0803054448 ,,, ,07:30,10:30,07:30,10:30,07:30,10:30,07:30,10:30,07:30,10:30,,,Uniti contro l'AIDS,https://www.uniticontrolaids.it/aids-ist/test/dove.aspx, Dati aggiornati al 23/10/2020 ,,,,,,,,,,,,,,,,,,,,,,,,,,,,,,,,,,,,,,,,,,,,,,,,,,,,,,,,,,,,,,,,,,,,,,,,,,,,,,,,,,,,,,,,,,,,,,,,,,,,
ASL BARI OSPEDALE DI VENERE, Servizio di Medicina Trasfusionale ,Via Ospedale di Venere Bari - BA , 0805015999 , 0805015228 Referente: Dott. Domenico Visceglie ,, ,08:00,09:30,08:00,09:30,08:00,09:30,08:00,09:30,08:00,09:30,08:00,09:30,Uniti contro l'AIDS,https://www.uniticontrolaids.it/aids-ist/test/dove.aspx, Dati aggiornati al 19/10/2020 ,,,,,,,,,,,,,,,,,,,,,,,,,,,,,,,,,,,,,,,,,,,,,,,,,,,,,,,,,,,,,,,,,,,,,,,,,,,,,,,,,,,,,,,,,,,,,,,,,,,,
AZIENDA OSPEDALIERA UNIVERSITARIA POLICLINICO CONSORZIALE, Ambulatorio Malattie Infettive ,"P.zza G. Cesare, 11 Bari - BA ", 0805592771 Referente: Prof.sa Annalisa Saracino ,,, ,08:00,14:00,08:00,14:00,08:00,14:00,08:00,14:00,08:00,14:00,08:00,13:00,Uniti contro l'AIDS,https://www.uniticontrolaids.it/aids-ist/test/dove.aspx, Dati aggiornati al 08/04/2019 ,,,,,,,,,,,,,,,,,,,,,,,,,,,,,,,,,,,,,,,,,,,,,,,,,,,,,,,,,,,,,,,,,,,,,,,,,,,,,,,,,,,,,,,,,,,,,,,,,,,,
OSPEDALE S. PAOLO, Centro Trasfusionale ,Via Caposcardicchio Bari - BA , 080.5843542 ,,, ,,,08:00,10:00,08:00,10:00,08:00,10:00,08:00,10:00,,,Uniti contro l'AIDS,https://www.uniticontrolaids.it/aids-ist/test/dove.aspx, Dati aggiornati al 04/11/2020 ,,,,,,,,,,,,,,,,,,,,,,,,,,,,,,,,,,,,,,,,,,,,,,,,,,,,,,,,,,,,,,,,,,,,,,,,,,,,,,,,,,,,,,,,,,,,,,,,,,,,
OSPEDALE CIVILE, Lab. Analisi ,"Via G. Comes, 31 Bitonto - BA ",,,, ,08:00,10:00,08:00,10:00,08:00,10:00,08:00,10:00,08:00,10:00,,,Uniti contro l'AIDS,https://www.uniticontrolaids.it/aids-ist/test/dove.aspx, Dati aggiornati al 16/11/2020 ,,,,,,,,,,,,,,,,,,,,,,,,,,,,,,,,,,,,,,,,,,,,,,,,,,,,,,,,,,,,,,,,,,,,,,,,,,,,,,,,,,,,,,,,,,,,,,,,,,,,
OSPEDALE CIVILE, Servizio Trasfusionale ,Via Provinciale per Terlizzi Molfetta - BA , 0803357499 ,,, ,08:00,10:00,08:00,10:00,08:00,10:00,08:00,10:00,08:00,10:00,08:00,10:00,Uniti contro l'AIDS,https://www.uniticontrolaids.it/aids-ist/test/dove.aspx, Dati aggiornati al 18/11/2020 ,,,,,,,,,,,,,,,,,,,,,,,,,,,,,,,,,,,,,,,,,,,,,,,,,,,,,,,,,,,,,,,,,,,,,,,,,,,,,,,,,,,,,,,,,,,,,,,,,,,,
PRESIDIO OSPEDALIERO S.MARIA DEGLI ANGELI, Laboratorio analisi ,Via Cappuccini Putignano - BA , 0804050111 ,,, ,07:00,11:00,07:00,11:00,07:00,11:00,07:00,11:00,07:00,11:00,07:00,11:00,Uniti contro l'AIDS,https://www.uniticontrolaids.it/aids-ist/test/dove.aspx, Dati aggiornati al 02/03/2018 ,,,,,,,,,,,,,,,,,,,,,,,,,,,,,,,,,,,,,,,,,,,,,,,,,,,,,,,,,,,,,,,,,,,,,,,,,,,,,,,,,,,,,,,,,,,,,,,,,,,,
OSPEDALE CIVILE MICHELE SARCONE, Laboratorio analisi ,"Via Pasquale Fiore, 135 Terlizzi - BA ", 0803608313 ,,, ,08:00,09:30,08:00,09:30,08:00,09:30,08:00,09:30,08:00,09:30,08:00,09:30,Uniti contro l'AIDS,https://www.uniticontrolaids.it/aids-ist/test/dove.aspx, Dati aggiornati al 29/10/2020 ,prenotazione CUP 0803608337,prenotazione CUP 0803608337,prenotazione CUP 0803608337,prenotazione CUP 0803608337,prenotazione CUP 0803608337,,,,,,,,,,,,,,,,,,,,,,,,,,,,,,,,,,,,,,,,,,,,,,,,,,,,,,,,,,,,,,,,,,,,,,,,,,,,,,,,,,,,,,,,,,,,,,,
PRESIDIO OSPEDALIERO DI VENERE-TRIGGIANO OSPEDALE CIVILE FRANCESCA FALLACARA," Laboratorio di Ricerche Chimico Cliniche e Microbiologiche V.le Aldo Moro, 32 Triggiano - BA ",, 0804626383 , 0804626301 ,, ,07:30,09:00,07:30,09:00,07:30,09:00,07:30,09:00,07:30,09:00,07:30,09:00,Uniti contro l'AIDS,https://www.uniticontrolaids.it/aids-ist/test/dove.aspx, Dati aggiornati al 10/09/2019 ,,,,,,,,,,,,,,,,,,,,,,,,,,,,,,,,,,,,,,,,,,,,,,,,,,,,,,,,,,,,,,,,,,,,,,,,,,,,,,,,,,,,,,,,,,,,,,,,,,,,
UOC Malattie Infettive PO Bari - Sud ASL BA, Ambulatorio Malattie Infettive/ Day Service ,"Via Aldo Moro,32 Triggiano - BA ", 0804626276 Referente: Dott.ssa Maria Federico ,,, ,08:30,13:00,08:30,13:00,08:30,13:00,08:30,13:00,08:00,13:00,,,Uniti contro l'AIDS,https://www.uniticontrolaids.it/aids-ist/test/dove.aspx, Dati aggiornati al 25/03/2019 ,accesso diretto,accesso diretto,accesso diretto,accesso diretto,accesso diretto,,,,,,,,,,,,,,,,,,,,,,,,,,,,,,,,,,,,,,,,,,,,,,,,,,,,,,,,,,,,,,,,,,,,,,,,,,,,,,,,,,,,,,,,,,,,,,,
OSPEDALE LORENZO BONOMO," Unità Operativa Semplice a Valenza Dipartimentale V.le Istria, 1 Andria - BT ",, 0883299129 , 0883299267 Referente: Dott. Luciano Lorusso ,, ,08:00,12:00,08:00,12:00,08:00,12:00,08:00,12:00,08:00,12:00,08:00,12:00,Uniti contro l'AIDS,https://www.uniticontrolaids.it/aids-ist/test/dove.aspx, Dati aggiornati al 14/05/2019 ,,,,,,,,,,,,,,,,,,,,,,,,,,,,,,,,,,,,,,,,,,,,,,,,,,,,,,,,,,,,,,,,,,,,,,,,,,,,,,,,,,,,,,,,,,,,,,,,,,,,
ASL BT OSPEDALE CIVILE MONSIGNOR ANGELO RAFFAELE DIMICCOLI, Servizio Trasfusionale V.le Ippocrate 15 Barletta - BT ,, 0883577293 Referente: Dott. Eugenio Peres ,,, ,08:00,10:00,08:00,10:00,08:00,10:00,08:00,10:00,08:00,10:00,08:00,10:00,Uniti contro l'AIDS,https://www.uniticontrolaids.it/aids-ist/test/dove.aspx, Dati aggiornati al 22/02/2018 ,anonimo,,,,,,,,,,,,,,,,,,,,,,,,,,,,,,,,,,,,,,,,,,,,,,,,,,,,,,,,,,,,,,,,,,,,,,,,,,,,,,,,,,,,,,,,,,,,,,,,,,,
OSPEDALE PERRINO," Ambulatorio Malattie Infettive - Scala A IV Piano Strada per Mesagne, 1 Brindisi - BR ",, 0831537397 , 0831537456 Referente: Dott. Salvatore Minniti ,, ,08:00,13:00,08:00,13:00,08:00,13:00,08:00,13:00,08:00,13:00,08:00,13:00,Uniti contro l'AIDS,https://www.uniticontrolaids.it/aids-ist/test/dove.aspx, Dati aggiornati al 16/12/2020 ,Accesso tramite prenotazione,Accesso tramite prenotazione,Accesso tramite prenotazione,Accesso tramite prenotazione,Accesso tramite prenotazione,Accesso tramite prenotazione,,,,,,,,,,,,,,,,,,,,,,,,,,,,,,,,,,,,,,,,,,,,,,,,,,,,,,,,,,,,,,,,,,,,,,,,,,,,,,,,,,,,,,,,,,,,,,
ASL BR P.O. OSPEDALE CIVILE DARIO GAMBERLINGO, Laboratorio di Patologia Clinica ,Via Madonna delle Grazie Francavilla Fontana - BR , 0831851251 , 0831851252 Referente: Dott. Vito Cornacchiulo ,, ,07:00,08:45,07:00,08:45,07:00,08:45,07:00,08:45,07:00,08:45,07:00,08:45,Uniti contro l'AIDS,https://www.uniticontrolaids.it/aids-ist/test/dove.aspx, Dati aggiornati al 20/10/2020 ,,,,15:00,,,,,16:30,,,,,,,,,,,,,,,,,,,,,,,,,,,,,,,,,,,,,,,,,,,,,,,,,,,,,,,,,,,,,,,,,,,,,,,,,,,,,,,,,,,,,,,,,,,
ASL BRINDISI -- S.O. OSTUNI, U.O.S. PATOLOGIA CLINICA ,Via Villafranca Ostuni - BR , 0831309268/70 , 0831309269 Referente: Dott. Paolo Ciola ,, ,08:00,10:00,08:00,10:00,08:00,10:00,08:00,10:00,08:00,10:00,08:00,10:00,Uniti contro l'AIDS,https://www.uniticontrolaids.it/aids-ist/test/dove.aspx, Dati aggiornati al 09/11/2020 ,Accesso diretto,Accesso diretto,Accesso diretto,Accesso diretto,Accesso diretto,Accesso diretto,,,,,,,,,,,,,,,,,,,,,,,,,,,,,,,,,,,,,,,,,,,,,,,,,,,,,,,,,,,,,,,,,,,,,,,,,,,,,,,,,,,,,,,,,,,,,,
OSPEDALE GIUSEPPE TATARELLA, Centro Trasfusionale ,Via Trinitapoli Cerignola - FG , 0885419426 , 0885419557 ,, ,08:00,13:00,08:00,13:00,08:00,13:00,08:00,13:00,08:00,13:00,08:00,13:00,Uniti contro l'AIDS,https://www.uniticontrolaids.it/aids-ist/test/dove.aspx, Dati aggiornati al 01/04/2019 ,,,,,,,,,,,,,,,,,,,,,,,,,,,,,,,,,,,,,,,,,,,,,,,,,,,,,,,,,,,,,,,,,,,,,,,,,,,,,,,,,,,,,,,,,,,,,,,,,,,,
OSPEDALI RIUNITI - AZIENDA OSPEDALIERA UNIVERSITARIA, Ambulatorio Malattie Infettive ,Viale Pinto n1 Foggia - FG , +39 0881 732201-733861 Referente: Dott. Sergio Ferrara ,,, ,08:00,13:00,08:00,13:00,08:00,13:00,08:00,13:00,08:00,13:00,,,Uniti contro l'AIDS,https://www.uniticontrolaids.it/aids-ist/test/dove.aspx, Dati aggiornati al 21/10/2020 ,Diretto,Diretto,Diretto,Diretto,Diretto,,,,,,,,,,,,,,,,,,,,,,,,,,,,,,,,,,,,,,,,,,,,,,,,,,,,,,,,,,,,,,,,,,,,,,,,,,,,,,,,,,,,,,,,,,,,,,,
