Istituto Nazionale per le Malattie Infettive Lazzaro Spallanzani," Centro di Riferimento AIDS - Ambulatorio ""Stanza 13 "" ",,,, Dott.ssa Nicoletta Orchi ,,,,,,,,,,,,,,Uniti contro l'AIDS,https://www.uniticontrolaids.it/aids-ist/test/dove.aspx, Dati aggiornati al 15 / 06 / 2020 ,,,,,,,,,,,,,,,,,,,,,," Via Portuense, 292 Roma - RM ", 06 55170645 , ,08:30,12:30,08:30,12:30,,,08:30,12:30,08:30,12:30,08:30,12:30,,14:00,Solo su appuntamento al 0655170645 o per email stanza13@inmi.it,14:00,Solo su appuntamento al 0655170645 o per email stanza13@inmi.it,Solo su appuntamento al 0655170645 o per email stanza13@inmi.it,Solo su appuntamento al 0655170645 o per email stanza13@inmi.it,,,,18:00,Solo su appuntamento al 0655170645 o per email stanza13@inmi.it,18:00,Solo su appuntamento al 0655170645 o per email stanza13@inmi.it,,,,,,,,,,,,,,,,,,,,,,,,,,,,,,,,,,,,,,,,,,,,,,,,,,
POLICLINICO DI TOR VERGATA, UOC Mal.Inf.Ambulatorio / Centri Prelievi / day hospital ,,,, Marcella Capozzi ,,,,,,,,,,,,,,Uniti contro l'AIDS,https://www.uniticontrolaids.it/aids-ist/test/dove.aspx, Dati aggiornati al 08 / 11 / 2020 ,,,,,,,,,,,,,,,,,,,,,," Via Oxford, 81 Roma - RM ", 0620903415 , ,08:00,11:00,08:00,11:00,08:00,11:00,08:00,11:00,08:00,11:00,,,,,,,,,,,,,,,,,,,,,,,,,,,,,,,,,,,,,,,,,,,,,,,,,,,,,,,,,,,,,,,,,,
POLICLINICO GEMELLI," Ambulatorio Malattie Infettive - Malattie Infettive 2 L.go Gemelli, 8 Roma - RM ",,,, Dott.ssa Enrica Tamburini ,,,,,,,,,,,,,,Uniti contro l'AIDS,https://www.uniticontrolaids.it/aids-ist/test/dove.aspx, Dati aggiornati al 05 / 03 / 2018 ,,,,,,,,,,,,,,,,,,,,,,, 0630154735 , ,08:30,12:00,08:30,12:00,08:30,12:00,08:30,12:00,08:30,12:00,,,,Prenotazione telefonica,Prenotazione telefonica,Prenotazione telefonica,Prenotazione telefonica,Prenotazione telefonica,,,,,,,,,,,,,,,,,,,,,,,,,,,,,,,,,,,,,,,,,,,,,,,,,,,,,,,,,,
POLICLINICO UMBERTO I° - AZIENDA OSPEDALIERO UNIVIVERSITARIA - UOD - SMID05- (Direttore V. Vullo) ,,,,, Dr.Luigi Rotundo ,,,,,,,,,,,,,,Uniti contro l'AIDS,https://www.uniticontrolaids.it/aids-ist/test/dove.aspx, Dati aggiornati al 29 / 05 / 2019 ,,,,,,,,,,,,,,,,,,,,,," Viale Regina Elena, 330 Roma - RM ", 06 / 4456388 - 06 / 49970875 , ,08:00,12:00,08:00,12:00,08:00,12:00,08:00,12:00,08:00,12:00,,,,Prelievi 8.00/9.30 - Risposte 8.30/10.00 - Visite 8.00/12.00,14:00,,,,, Centro di Riferimento AIDS - Unità Operativa di III Livello ,15:30,,,,,,Prelievi 8.00/9.30 - Risposte 8.30/10.00 - 14.00/15.30 - Visite 8.00/12.00 - 14.00 / 15.30 ,,,,,,,,,,,,,,,,,,,,,,,,,,,,,,,,,,,,,,,,,,,,,,,,,
OSPEDALE ANGELUCCI, ASL RMG - Lab.Analisi Contrada Colle Cisterna Subiaco - RM ,,,,,,,,,,,,,,,,,,Uniti contro l'AIDS,https://www.uniticontrolaids.it/aids-ist/test/dove.aspx, Dati aggiornati al 25 / 01 / 2018 ,,,,,,,,,,,,,,,,,,,,,,, 07748115294 , ,08:00,10:30,08:00,10:30,08:00,10:30,08:00,10:30,08:00,10:30,08:00,10:30,,,,,,,,,,,,,,,,,,,,,,,,,,,,,,,,,,,,,,,,,,,,,,,,,,,,,,,,,,,,,,,,
POLIAMBULATORIO, Centro Prelievi Largo Donatori del sangue 6 Tolfa - RM ,,,,,,,,,,,,,,,,,,Uniti contro l'AIDS,https://www.uniticontrolaids.it/aids-ist/test/dove.aspx, Dati aggiornati al 09 / 11 / 2020 ,,,,,,,,,,,,,,,,,,,,,,, 0696669106 , ,07:30,09:30,,,07:30,09:30,07:30,09:30,,,,,,,,,,,,,,,,,,,,,,,,,,,,,,,,,,,,,,,,,,,,,,,,,,,,,,,,,,,,,,,,,,,,
POLIAMBULATORIO CENTRO PRELIEVI, Laboratorio Analisi ,,,, Sig.ra Stocco ,,,,,,,,,,,,,,Uniti contro l'AIDS,https://www.uniticontrolaids.it/aids-ist/test/dove.aspx, Dati aggiornati al 23 / 02 / 2018 ,,,,,,,,,,,,,,,,,,,,,, Via Borgo San Martino 11 Zagarolo - RM , 0695322809 , ,07:30,09:00,07:30,09:00,07:30,09:00,07:30,09:00,07:30,09:00,07:30,09:00,,Accesso diretto,Accesso diretto,Accesso diretto,Accesso diretto,Accesso diretto,Accesso diretto,,,,,,,,,,,,,,,,,,,,,,,,,,,,,,,,,,,,,,,,,,,,,,,,,,,,,,,,,
OSPEDALE CIVILE ANDOSILLA, Laboratorio Analisi Cliniche e Microbiologiche ,,,,,,,,,,,,,,,,,,Uniti contro l'AIDS,https://www.uniticontrolaids.it/aids-ist/test/dove.aspx, Dati aggiornati al 04 / 11 / 2020 ,,,,,,,,,,,,,,,,,,,,,," Via Ferretti, 169 Civita Castellana - VT ", 0761592254 , ,07:30,09:15,07:30,09:15,07:30,09:15,07:30,09:15,07:30,09:15,07:30,09:15, 0761592214 ,su prenotazione,su prenotazione,su prenotazione,su prenotazione,su prenotazione,su prenotazione,,,,,,,,,,,,,,,,,,,,,,,,,,,,,,,,,,,,,,,,,,,,,,,,,,,,,,,,,
OSPEDALE CIVILE, Lab.Analisi Cliniche ,,,, Dott.ssa Maria Assunta Silvestri ,,,,,,,,,,,,,,Uniti contro l'AIDS,https://www.uniticontrolaids.it/aids-ist/test/dove.aspx, Dati aggiornati al 23 / 02 / 2018 ,,,,,,,,,,,,,,,,,,,,,, Via Verentana Montefiascone - VT , 0761833248 , ,07:30,09:30,07:30,09:30,07:30,09:30,07:30,09:30,07:30,09:30,,, 0761823932 ,,,,,,,,,,,,,,,,,,,,,,,,,,,,,,,,,,,,,,,,,,,,,,,,,,,,,,,,,,,,,,,
OSPEDALE CIVILE, U.O.S.D.Diagnostica Clinica d 'Urgenza Tarquinia ,,,, Dottoressa Federica RICCETTI ,,,,,,,,,,,,,,Uniti contro l'AIDS,https://www.uniticontrolaids.it/aids-ist/test/dove.aspx, Dati aggiornati al 04 / 11 / 2020 ,,,,,,,,,,,,,,,,,,,,,," Viale Igea, 1 Tarquinia - VT ", 0766846329 / 328 / 252 , ,07:15,09:00,07:15,09:00,07:15,09:00,07:15,09:00,07:15,09:00,07:15,09:30, 0766846255 ,,,,,,,,,,,,,,,,,,,,,,,,,,,,,,,,,,,,,,,,,,,,,,,,,,,,,,,,,,,,,,,
OSPEDALE BELCOLLE, Centro di Riferimento AIDS - III livello Strada S.Martinese Viterbo - VT ,,,, Dott.Roberto Monarca ,,,,,,,,,,,,,,Uniti contro l'AIDS,https://www.uniticontrolaids.it/aids-ist/test/dove.aspx, Dati aggiornati al 15 / 05 / 2019 ,,,,,,,,,,,,,,,,,,,,,,, 0761 339047 , ,08:00,14:00,08:00,14:00,08:00,14:00,08:00,14:00,08:00,14:00,08:00,14:00, 0761 339046 ,,,,,,,,,,,,,,,,,,,,,,,,,,,,,,,,,,,,,,,,,,,,,,,,,,,,,,,,,,,,,,,
ENTE OSPEDALIERO OSPEDALE GALLIERA," Struttura Complessa Malattie Infettive, Ambulatorio Malattie Infettive - Pad.A1 ",,,,,,,,,,,,,,,,,,Uniti contro l'AIDS,https://www.uniticontrolaids.it/aids-ist/test/dove.aspx, Dati aggiornati al 14 / 10 / 2020 ,,,,,,,,,,,,,,,,,,,,,," Via Alessandro Volta, 8 Genova - GE ", 010 5634470 , ,07:30,13:00,07:30,13:00,07:30,13:00,07:30,13:00,07:30,13:00,,, 010 5634474 ,,,,,,presente medico di reparto per urgenze,,,,,,,,,,,presente medico di reparto per urgenze,,,,,,,,,,,,,,,,,,,,,,,,,,,,,,,,,,,,,,,,,,,,,,
ISTITUTO PEDIATRICO GIANNINA GASLINI, Sezione di Immunoematologia e Medicina trasfusionale - Piano terra - Pad.12 ,,,,,,,,,,,,,,,,,,Uniti contro l'AIDS,https://www.uniticontrolaids.it/aids-ist/test/dove.aspx, Dati aggiornati al 05 / 03 / 2019 ,,,,,,,,,,,,,,,,,,,,,," Via Gerolamo Gaslini, 5 Genova - GE ", 01056362417 , ,08:00,10:00,08:00,10:00,08:00,10:00,08:00,10:00,08:00,10:00,08:00,10:00,,,,,,,,,,,,,,,,08:00,10:00,,,,,,,,,,,,,,,,,,,,,,,,,,,,,,,,,,,,,,,,,,,,,,,
OSPEDALE POLICLINICO S.MARTINO CLINICA MALATTIE INFETTIVE ,,,,, Antonio Di Biagio ,,,,,,,,,,,,,,Uniti contro l'AIDS,https://www.uniticontrolaids.it/aids-ist/test/dove.aspx, Dati aggiornati al 26 / 10 / 2020 ,,,,,,,,,,,,,,,,,,,,,,, 0105554646 , ,08:45,13:00,08:15,13:00,08:15,13:00,08:15,13:00,08:15,13:00,,,,,,,,,, Amulatorio Malattie Infettive - Piano - 2 - Padiglione Patologie Complesse L.go Rossana Benzi 10 Genova - GE ,,,,,,,,,,,,,,,,,,,,,,,,,,,,,,,,,,,,,,,,,,,,,,,,,,,,,,,,
ASL 1 IMPERIESE, Laboratorio Analisi ,,,, Dott.Claudio Muratore ,,,,,,,,,,,,,,Uniti contro l'AIDS,https://www.uniticontrolaids.it/aids-ist/test/dove.aspx, Dati aggiornati al 15 / 04 / 2019 ,,,,,,,,,,,,,,,,,,,,,," Via Aurelia, 122 Bordighera - IM ", 0184534647 , ,07:30,09:30,07:30,09:30,07:30,09:30,07:30,09:30,07:30,09:30,08:00,09:00, 0184534643 ,,,,,,,,,,,,,,,,,,,,,,,,,,,,,,,,,,,,,,,,,,,,,,,,,,,,,,,,,,,,,,,
ASL 1 IMPERIESE, Laboratorio Analisi ,,,, dott.ssa P.Rivera ,,,,,,,,,,,,,,Uniti contro l'AIDS,https://www.uniticontrolaids.it/aids-ist/test/dove.aspx, Dati aggiornati al 04 / 11 / 2020 ,,,,,,,,,,,,,,,,,,,,,," Via S.Agata, 57 Imperia - IM ", 0183537329 , ,07:15,09:30,07:15,09:30,07:15,09:30,07:15,09:30,07:15,09:30,07:15,09:30,,,,,,,,,,,,,,,,,,,,,,,,,,,,,,,,,,,,,,,,,,,,,,,,,,,,,,,,,,,,,,,,
OSPEDALE CIVILE S. AGATA, Centro Trasfusionale ,"Via S. Agata, 57 Imperia - IM ", 0183537290 ,,, ,,,,,,,,,,,,,Uniti contro l'AIDS,https://www.uniticontrolaids.it/aids-ist/test/dove.aspx, Dati aggiornati al 13/07/2017 ,,,,,,,,,,,,,,,,,,,,,,,,,,,,,,,,,,,,,,,,,,,,,,,,,,,,,,,,,,,,,,,,,,,,,,,,,,,,,,,,,,,,,,,,,,,,,,,,,,,,
ASL 1 (AZIENDA OSPEDALE IMPERIESE) OSPEDALE CIVILE SANREMO, Dipartimento Medico - Ambulatorio Malattie Infettive ,"Via G. Borea, 56 Sanremo - IM ", 0184536844 , 0184536928 , Dr Giovanni Cenderello , ,08:00,14:00,08:00,14:00,08:00,14:00,08:00,14:00,08:00,14:00,,,Uniti contro l'AIDS,https://www.uniticontrolaids.it/aids-ist/test/dove.aspx, Dati aggiornati al 11/01/2021 ,14:00,Diretto,Diretto,Diretto,Diretto,,,,,,,,17:00,,,Diretto,,,,,,,,,,,,,,,,,,,,,,,,,,,,,,,,,,,,,,,,,,,,,,,,,,,,,,,,,,,,,,,,,,,,,,,,,,,,,,,,,,,,
OSPEDALE SAN BARTOLOMEO - AMBULATORIO DI MALATTIE INFETTIVE, Struttura Complessa Malattie Infettive ed Epatologia ,Via Variante Cisa Sud Sarzana - SP , 0187/604589 , 0187/51133 , Dott. Michele Guerra , ,08:00,16:00,08:00,16:00,08:00,16:00,08:00,16:00,08:00,16:00,08:00,13:00,Uniti contro l'AIDS,https://www.uniticontrolaids.it/aids-ist/test/dove.aspx, Dati aggiornati al 07/06/2019 ,,,,,,Solo il sabato: attività svolta in degenza Osp. S.Andrea La Spezia,,,,,,,,,,,,,,,,,,,,,,,,,,,,,,,,,,,,,,,,,,,,,,,,,,,,,,,,,,,,,,,,,,,,,,,,,,,,,,,,,,,,,,,,,,,,,,
AZIENDA SANITARIA ASL2 SAVONESE OSPEDALE S.M DELLA MISERICORDIA, Ambulatorio di Malattie Infettive ,Via Martiri della foce (zona Bagnoli) Albenga - SV , 0182/546062 , 0182/546345 , Dott. V. Bartolacci , ,08:00,13:00,08:00,13:00,08:00,13:00,08:00,13:00,08:00,13:00,08:00,13:00,Uniti contro l'AIDS,https://www.uniticontrolaids.it/aids-ist/test/dove.aspx, Dati aggiornati al 19/02/2020 ,per i prelievi 8-9.30,per i prelievi 8-9.30,prelievi 8-9.30,prelievi 8-9.30,prelievi 8-9.30,prelievi 8-9.30,,,,,,,,,,,,,,,,,,,,,,,,,,,,,,,,,,,,,,,,,,,,,,,,,,,,,,,,,,,,,,,,,,,,,,,,,,,,,,,,,,,,,,,,,,,,,,
ASL 2 SAVONESE OSPEDALE S. PAOLO, Ambulatorio Malattie Infettive ,"Via Genova, 20 Savona - SV ", 0198404613 0198404812 , 0198404364 , Dott.ssa Pasqualina De Leo , ,07:30,13:30,07:30,13:30,07:30,13:30,07:30,13:30,07:30,13:30,07:30,13:30,Uniti contro l'AIDS,https://www.uniticontrolaids.it/aids-ist/test/dove.aspx, Dati aggiornati al 01/03/2018 ,prelievi entro le ore 10.00,prelievi entro le ore 10.00,prelievi entro le ore 10.00,prelievi entro le ore 10.00,prelievi entro le ore 10.00,urgenze,,,,,,,,,,,,,,,,,,,,,,,,,,,,,,,,,,,,,,,,,,,,,,,,,,,,,,,,,,,,,,,,,,,,,,,,,,,,,,,,,,,,,,,,,,,,,,
OSPEDALE S.PAOLO, Servizio Immunoematologia e Medicina Trasfusionale ,"Via Genova, 30 (Località Valloria) Savona - SV ", 0198404400 , 0198404476 , Dott.ssa Viviana Panunzio , ,11:00,13:30,11:00,13:30,11:00,13:30,11:00,13:30,11:00,13:30,11:00,13:30,Uniti contro l'AIDS,https://www.uniticontrolaids.it/aids-ist/test/dove.aspx, Dati aggiornati al 31/12/2020 ,,,,,,,,,,,,,,,,,,,,,,,,,,,,,,,,,,,,,,,,,,,,,,,,,,,,,,,,,,,,,,,,,,,,,,,,,,,,,,,,,,,,,,,,,,,,,,,,,,,,
AZIENDA OSPEDALIERA PAPA GIOVANNI XXIII°, Punto Prelievi ,"Via OMS, 1 Bergamo - BG ", 0352674209 ,,, ,07:00,10:00,07:00,10:00,07:00,10:00,07:00,10:00,07:00,10:00,,,Uniti contro l'AIDS,https://www.uniticontrolaids.it/aids-ist/test/dove.aspx, Dati aggiornati al 09/07/2019 ,,,,,,,,,,,,,,,,,,,,,,,,,,,,,,,,,,,,,,,,,,,,,,,,,,,,,,,,,,,,,,,,,,,,,,,,,,,,,,,,,,,,,,,,,,,,,,,,,,,,
OSPEDALE PAPA GIOVANNI XXIII, U.O Dermatologia - Centro Malattie a Trasmissione Sessuale ,"Via Oms, 1 Bergamo - BG ",, 0352674841 , Dott. Andrea Gustavo Locatelli , ,09:20,11:30,09:20,11:30,09:20,11:30,09:20,11:30,09:20,11:30,,,Uniti contro l'AIDS,https://www.uniticontrolaids.it/aids-ist/test/dove.aspx, Dati aggiornati al 04/11/2020 ,,,,,,,,,,,,,,,,,,,,,,,,,,,,,,,,,,,,,,,,,,,,,,,,,,,,,,,,,,,,,,,,,,,,,,,,,,,,,,,,,,,,,,,,,,,,,,,,,,,,
ASST-BERGAMOEST Presidio Ospedaliero di Lovere - Servizio Patologia Clinica, Laboratorio analisi ,"Via Martinoli, 9 Lovere - BG ", 0353067269/0353067289 , 0353067241 , Dott.ssa Patrizia Fossati , ,07:30,09:30,07:30,09:30,07:30,09:30,07:30,09:30,07:30,09:30,,,Uniti contro l'AIDS,https://www.uniticontrolaids.it/aids-ist/test/dove.aspx, Dati aggiornati al 07/10/2019 ,Accesso diretto,Accesso diretto,Accesso diretto,Accesso diretto,Accesso diretto,,,,,,,,,,,,,,,,,,,,,,,,,,,,,,,,,,,,,,,,,,,,,,,,,,,,,,,,,,,,,,,,,,,,,,,,,,,,,,,,,,,,,,,,,,,,,,,
PRESIDIO OSPEDALIERO BOLOGNINI - OSPEDALE CIVILE, Laboratorio Analisi ,"Via Groppino, 22 Piario - BG ", 034669226 - 034669278 , 034669445 , Dott.ssa Patrizia Fossati , ,07:30,09:30,07:30,09:30,07:30,09:30,07:30,09:30,07:30,09:30,,,Uniti contro l'AIDS,https://www.uniticontrolaids.it/aids-ist/test/dove.aspx, Dati aggiornati al 01/07/2019 ,,,,,,,,,,,,,,,,,,,,,,,,,,,,,,,,,,,,,,,,,,,,,,,,,,,,,,,,,,,,,,,,,,,,,,,,,,,,,,,,,,,,,,,,,,,,,,,,,,,,
ASST BERGAMOEST OSPEDALE BOLOGNINI SERIATE, U.O. Medicina di Laboratorio - Punto Prelievi ,"Via Paderno, 21 Seriate - BG ", 0353063276 ,, Dott.ssa Silvia Felini , ,07:30,12:00,07:30,12:00,07:30,12:00,07:30,12:00,07:30,12:00,,,Uniti contro l'AIDS,https://www.uniticontrolaids.it/aids-ist/test/dove.aspx, Dati aggiornati al 20/10/2020 ,,,,,,,,,,,,,,,,,,,,,,,,,,,,,,,,,,,,,,,,,,,,,,,,,,,,,,,,,,,,,,,,,,,,,,,,,,,,,,,,,,,,,,,,,,,,,,,,,,,,
Azienda Socio Sanitaria Bergamo Ovest, Laboratorio Analisi ,"Piazzale Meneguzzo, 1 Treviglio - BG ", 0363424706 , 0363424581 , Dott.ssa Maria Antonietta Fasano , ,07:00,10:00,07:00,10:00,07:00,10:00,07:00,10:00,07:00,10:00,07:00,10:00,Uniti contro l'AIDS,https://www.uniticontrolaids.it/aids-ist/test/dove.aspx, Dati aggiornati al 27/10/2020 ,Accesso diretto,Accesso diretto,Accesso diretto,Accesso diretto,Accesso diretto,Accesso diretto,,,,,,,,,,,,,,,,,,,,,,,,,,,,,,,,,,,,,,,,,,,,,,,,,,,,,,,,,,,,,,,,,,,,,,,,,,,,,,,,,,,,,,,,,,,,,,
ASST GARDA, PUNTO PRELIEVO ,Via Tito Speri 16/A Bagolino - BS , 036599107 ,, Dott.ssa Maria Grazia Marin , ,,,07:00,08:30,,,,,07:00,08:30,,,Uniti contro l'AIDS,https://www.uniticontrolaids.it/aids-ist/test/dove.aspx, Dati aggiornati al 26/10/2020 ,,,,,,,,,,,,,,,,,,,,,,,,,,,,,,,,,,,,,,,,,,,,,,,,,,,,,,,,,,,,,,,,,,,,,,,,,,,,,,,,,,,,,,,,,,,,,,,,,,,,
ATS MONTAGNA, Dipartimento di Igiene e Prevenzione Sanitaria ,"Via Nissolina, 2 Breno - BS ", 800076323 ,,, ,08:30,12:30,08:30,12:30,08:30,12:30,08:30,12:30,08:30,12:30,,,Uniti contro l'AIDS,https://www.uniticontrolaids.it/aids-ist/test/dove.aspx, Dati aggiornati al 25/03/2019 ,Su appuntamento,Su appuntamento,Su appuntamento,Su appuntamento,Su appuntamento,,,,,,,,,,,,,,,,,,,,,,,,,,,,,,,,,,,,,,,,,,,,,,,,,,,,,,,,,,,,,,,,,,,,,,,,,,,,,,,,,,,,,,,,,,,,,,,
ASST Spedali Civili di Brescia, Struttura Semplice Medicina Transculturale e Malattie a Trasmissione Sessuale ,"Viale del Piave, 40 Brescia - BS ", 0303333456 ,, Dr. Issa El Hamad/Dr.ssa Scolari Carla , ,10:15,12:00,10:00,11:30,10:15,12:00,,,10:15,12:00,,,Uniti contro l'AIDS,https://www.uniticontrolaids.it/aids-ist/test/dove.aspx, Dati aggiornati al 16/10/2020 ,su prenotazione,13:00,su prenotazione,,su prenotazione,,15:00,su prenotazione,,,,,,,,,,,,,,,,,,,,,,,,,,,,,,,,,,,,,,,,,,,,,,,,,,,,,,,,,,,,,,,,,,,,,,,,,,,,,,,,,,,,,,,,,,,,
ASST SPEDALI CIVILI DI BRESCIA - UNIVERSITA' DEGLI STUDI DI BRESCIA - CLINICA MALATTIE INFETTIVE E TROPICALI, Ambulatorio di Malattie Infettive/Piano terra ,"Piazzale Spedali Civili, 1 Brescia - BS ", 0303995677 ,, Dott. Issa El Hamad , ,08:30,12:30,08:30,12:30,08:30,12:30,08:30,12:30,08:30,12:30,,,Uniti contro l'AIDS,https://www.uniticontrolaids.it/aids-ist/test/dove.aspx, Dati aggiornati al 01/12/2020 ,14:00,14:00,14:00,14:00,previa prenotazione,,16:00,previa prenotazione,16:00,previa prenotazione,,,16:00,16:00,,previa prenotazione,previa prenotazione,,,,,,,,,,,,,,,,,,,,,,,,,,,,,,,,,,,,,,,,,,,,,,,,,,,,,,,,,,,,,,,,,,,,,,,,,,,,,,,,,,,
ATS BRESCIA-LABORATORIO DI SANITA' PUBBLICA, Laboratorio Analisi ,Via Balestrieri 7 Brescia - BS , 030-3838646 - 030-3838657 , 030-3838469 ,,,,,,,,,,,,,,,,, Dati aggiornati al 04/11/2020 ,,,,,,,,,,,,,,,,,,,,,,,,,,,,,,,,,,,,,,,,,,,,,,,,,,,,,,,,,,,,,,,,,,,,,,,,,,,,,,,,,,,,,,,,,,,,,,,,,,,,
ASST GARDA, PUNTO PRELIEVO ,Via XXIV Maggio Capovalle - BS , 0365296720 ,, Dott.ssa Maria Grazia Marin , ,06:45,07:30,,,,,,,,,,,Uniti contro l'AIDS,https://www.uniticontrolaids.it/aids-ist/test/dove.aspx, Dati aggiornati al 15/03/2019 ,a settimane alterne,,,,,,,,,,,,,,,,,,,,,,,,,,,,,,,,,,,,,,,,,,,,,,,,,,,,,,,,,,,,,,,,,,,,,,,,,,,,,,,,,,,,,,,,,,,,,,,,,,,
Laboratorio di Patologia Clinica PUNTO PRELIEVI di DARFO ASST VALCAMONICA, Punto Prelievi di Darfo ,Via Cercovi Darfo Boario Terme - BS , 0364 540111 ,,, ,07:30,08:30,07:30,08:30,07:30,08:30,07:30,08:30,07:30,08:30,,,Uniti contro l'AIDS,https://www.uniticontrolaids.it/aids-ist/test/dove.aspx, Dati aggiornati al 18/07/2019 ,,,,,,,,,,,,,,,,,,,,,,,,,,,,,,,,,,,,,,,,,,,,,,,,,,,,,,,,,,,,,,,,,,,,,,,,,,,,,,,,,,,,,,,,,,,,,,,,,,,,
OSPEDALE DI DESENZANO, PUNTO PRELIEVO località Montecroce 1 Desenzano del Garda - BS ,, 0309145569 , 0309145355 , Dott.ssa Maria Grazia Marin , ,07:30,10:30,07:30,10:30,07:30,10:30,07:30,10:30,07:30,10:30,07:30,10:30,Uniti contro l'AIDS,https://www.uniticontrolaids.it/aids-ist/test/dove.aspx, Dati aggiornati al 13/03/2019 ,,,,,,,,,,,,,,,,,,,,,,,,,,,,,,,,,,,,,,,,,,,,,,,,,,,,,,,,,,,,,,,,,,,,,,,,,,,,,,,,,,,,,,,,,,,,,,,,,,,,
OSPEDALE di EDOLO ASST VALCAMONICA, Laboratorio di Patologia Clinica - Centro Prelievi Edolo ,"Piazza Donatori di Sangue, 1 Edolo - BS ", 0364 772908 , 0364 772531 , Dott. G. Fiordalisi , ,07:30,09:00,07:30,09:00,07:30,09:00,07:30,09:00,07:30,09:00,07:30,09:00,Uniti contro l'AIDS,https://www.uniticontrolaids.it/aids-ist/test/dove.aspx, Dati aggiornati al 14/11/2020 ,,,,,,,,,,,,,,,,,,,,,,,,,,,,,,,,,,,,,,,,,,,,,,,,,,,,,,,,,,,,,,,,,,,,,,,,,,,,,,,,,,,,,,,,,,,,,,,,,,,,
OSPEDALE di ESINE ASST VALCAMONICA, Laboratorio Analisi ,Via A. Manzoni 142 Esine - BS , 0364 369342 , 0364369407 , Dott.ssa Graziella Bonetti , ,07:30,09:00,07:30,09:00,07:30,09:00,07:30,09:00,07:30,09:00,07:30,09:00,Uniti contro l'AIDS,https://www.uniticontrolaids.it/aids-ist/test/dove.aspx, Dati aggiornati al 11/06/2019 ,,,,,,,,,,,,,,,,,,,,,,,,,,,,,,,,,,,,,,,,,,,,,,,,,,,,,,,,,,,,,,,,,,,,,,,,,,,,,,,,,,,,,,,,,,,,,,,,,,,,
SPEDALI CIVILI DI BRESCIA - PRESIDIO OSPEDALIERO 0SPEDALE di GARDONE, Laboratorio analisi chimico cliniche ,"Via Giovanni XXIII, 4 Gardone Val Trompia - BS ", 0308933212 , 0308933271 ,, ,07:00,10:00,07:00,10:00,07:00,10:00,07:00,10:00,07:00,10:00,07:00,10:00,Uniti contro l'AIDS,https://www.uniticontrolaids.it/aids-ist/test/dove.aspx, Dati aggiornati al 30/07/2019 ,Accesso diretto,Accesso diretto,Accesso diretto,Accesso diretto,Accesso diretto,Accesso diretto,,,,,,,,,,,,,,,,,,,,,,,,,,,,,,,,,,,,,,,,,,,,,,,,,,,,,,,,,,,,,,,,,,,,,,,,,,,,,,,,,,,,,,,,,,,,,,
ASST GARDA, PUNTO PRELIEVO ,Via Repubblica 2 Gargnano - BS , 036572716 ,, Dott.ssa Maria Grazia Marin , ,07:30,09:00,07:30,09:00,07:30,09:00,07:30,09:00,07:30,09:00,,,Uniti contro l'AIDS,https://www.uniticontrolaids.it/aids-ist/test/dove.aspx, Dati aggiornati al 12/07/2019 ,,,,,,,,,,,,,,,,,,,,,,,,,,,,,,,,,,,,,,,,,,,,,,,,,,,,,,,,,,,,,,,,,,,,,,,,,,,,,,,,,,,,,,,,,,,,,,,,,,,,
ASST del Garda - PO GAVARDO-SALO', Laboratorio analisi cliniche ,"Via Andrea Gosa, 74 Gavardo - BS ", 0365378420 , 0365378235 ,, ,07:30,09:30,07:30,09:30,07:30,09:30,07:30,09:30,07:30,09:30,07:30,09:30,Uniti contro l'AIDS,https://www.uniticontrolaids.it/aids-ist/test/dove.aspx, Dati aggiornati al 12/12/2020 ,,,,,,,,,,,,,,,,,,,,,,,,,,,,,,,,,,,,,,,,,,,,,,,,,,,,,,,,,,,,,,,,,,,,,,,,,,,,,,,,,,,,,,,,,,,,,,,,,,,,
AZIENDA SOCIO SANITARIA TERRITORIALE DELLA FRANCIACORTA, Laboratorio Analisi Chimiche Cliniche e Microbiologiche ,"Via GiardinI Garibaldi, 10 Iseo - BS ", 0309887269 , 0309887353 ,, ,07:15,09:30,07:15,09:30,07:15,09:30,07:15,09:30,07:15,09:30,07:30,09:00,Uniti contro l'AIDS,https://www.uniticontrolaids.it/aids-ist/test/dove.aspx, Dati aggiornati al 28/03/2019 ,,,,,,,,,,,,,,,,,,,,,,,,,,,,,,,,,,,,,,,,,,,,,,,,,,,,,,,,,,,,,,,,,,,,,,,,,,,,,,,,,,,,,,,,,,,,,,,,,,,,
ASST GARDA, PUNTO PRELIEVO ,Via Don A. Merici 3 Manerba del Garda - BS , 0309145331 ,, Dott.ssa Maria Grazia Marin , ,07:30,09:30,07:30,09:30,,,,,07:30,09:30,,,Uniti contro l'AIDS,https://www.uniticontrolaids.it/aids-ist/test/dove.aspx, Dati aggiornati al 12/07/2019 ,,,,,,,,,,,,,,,,,,,,,,,,,,,,,,,,,,,,,,,,,,,,,,,,,,,,,,,,,,,,,,,,,,,,,,,,,,,,,,,,,,,,,,,,,,,,,,,,,,,,
ASST GARDA, PUNTO PRELIEVO ,Via Inganni 24 Mazzano - BS , 0309145331 , 0309145335 , Dott.ssa Maria Grazia Marin , ,,,07:00,09:30,07:00,09:30,07:00,09:30,,,07:00,09:30,Uniti contro l'AIDS,https://www.uniticontrolaids.it/aids-ist/test/dove.aspx, Dati aggiornati al 12/07/2019 ,,,,,,,,,,,,,,,,,,,,,,,,,,,,,,,,,,,,,,,,,,,,,,,,,,,,,,,,,,,,,,,,,,,,,,,,,,,,,,,,,,,,,,,,,,,,,,,,,,,,
ASST GARDA, PUNTO PRELIEVO ,Via IV Novembre 5/B Odolo - BS , 0365860366 ,, Dott.ssa Maria Grazia Marin , ,07:00,09:00,07:00,09:00,,,,,07:00,09:00,,,Uniti contro l'AIDS,https://www.uniticontrolaids.it/aids-ist/test/dove.aspx, Dati aggiornati al 27/10/2020 ,,,,,,,,,,,,,,,,,,,,,,,,,,,,,,,,,,,,,,,,,,,,,,,,,,,,,,,,,,,,,,,,,,,,,,,,,,,,,,,,,,,,,,,,,,,,,,,,,,,,
Laboratorio di Patologia Clinca Punto Prelievi di Pisogne ASST di Valcamonica, Punto Prelievi di Pisogne ,"Via Valeriana,1 Pisogne - BS ", 0364 540119 ,, Dott.ssa Graziella Bonetti , ,07:30,08:30,07:30,08:30,07:30,08:30,07:30,08:30,07:30,08:30,,,Uniti contro l'AIDS,https://www.uniticontrolaids.it/aids-ist/test/dove.aspx, Dati aggiornati al 11/06/2019 ,,,,,,,,,,,,,,,,,,,,,,,,,,,,,,,,,,,,,,,,,,,,,,,,,,,,,,,,,,,,,,,,,,,,,,,,,,,,,,,,,,,,,,,,,,,,,,,,,,,,
ASST GARDA, PUNTO PRELIEVO ,Via Longarone 22 Pozzolengo - BS , 0309145331 ,, Dott.ssa Maria Grazia Marin , ,,,07:30,09:30,,,,,07:30,09:30,,,Uniti contro l'AIDS,https://www.uniticontrolaids.it/aids-ist/test/dove.aspx, Dati aggiornati al 18/03/2019 ,,,,,,,,,,,,,,,,,,,,,,,,,,,,,,,,,,,,,,,,,,,,,,,,,,,,,,,,,,,,,,,,,,,,,,,,,,,,,,,,,,,,,,,,,,,,,,,,,,,,
ASST del Garda, PUNTO PRELIEVI SALO' ,"P.zza Bresciani, 5 Salò - BS ",,,, ,07:30,09:30,07:30,09:30,07:30,09:30,07:30,09:30,07:30,09:30,07:30,09:00,Uniti contro l'AIDS,https://www.uniticontrolaids.it/aids-ist/test/dove.aspx, Dati aggiornati al 13/03/2019 ,,,,,,,,,,,,,,,,,,,,,,,,,,,,,,,,,,,,,,,,,,,,,,,,,,,,,,,,,,,,,,,,,,,,,,,,,,,,,,,,,,,,,,,,,,,,,,,,,,,,
ASST GARDA, PUNTO PRELIEVO ,P.zza Virgilio 1 Sirmione - BS , 0309145331 , 0309145335 , Dott.ssa Maria Grazia Marin , ,07:30,09:30,,,07:30,09:30,07:30,09:30,,,07:30,09:30,Uniti contro l'AIDS,https://www.uniticontrolaids.it/aids-ist/test/dove.aspx, Dati aggiornati al 18/03/2019 ,,,,,,,,,,,,,,,,,,,,,,,,,,,,,,,,,,,,,,,,,,,,,,,,,,,,,,,,,,,,,,,,,,,,,,,,,,,,,,,,,,,,,,,,,,,,,,,,,,,,
ASST GARDA, PUNTO PRELIEVO ,Via Provinciale 1 Valvestino - BS , 0365296720 ,, Dott.ssa Maria Grazia Marin , ,07:45,08:30,,,,,,,,,,,Uniti contro l'AIDS,https://www.uniticontrolaids.it/aids-ist/test/dove.aspx, Dati aggiornati al 15/03/2019 ,a settimane alterne,,,,,,,,,,,,,,,,,,,,,,,,,,,,,,,,,,,,,,,,,,,,,,,,,,,,,,,,,,,,,,,,,,,,,,,,,,,,,,,,,,,,,,,,,,,,,,,,,,,
ASST GARDA, PUNTO PRELIEVO ,"Via Reverberi, 2 Vestone - BS ", 0365296720 ,, Dott.ssa Maria Grazia Marin , ,07:30,08:45,07:30,08:45,07:30,08:45,07:30,08:45,07:30,08:45,07:30,08:45,Uniti contro l'AIDS,https://www.uniticontrolaids.it/aids-ist/test/dove.aspx, Dati aggiornati al 18/11/2020 ,,,,,,,,,,,,,,,,,,,,,,,,,,,,,,,,,,,,,,,,,,,,,,,,,,,,,,,,,,,,,,,,,,,,,,,,,,,,,,,,,,,,,,,,,,,,,,,,,,,,
ASST GARDA, PUNTO PRELIEVO ,"Via Falck, 5 Vobarno - BS ", 036561102 ,, Dott.ssa Maria Grazia Marin , ,07:30,09:00,07:30,09:00,07:30,09:00,07:30,09:00,07:30,09:00,,,Uniti contro l'AIDS,https://www.uniticontrolaids.it/aids-ist/test/dove.aspx, Dati aggiornati al 16/12/2020 ,,,,,,,,,,,,,,,,,,,,,,,,,,,,,,,,,,,,,,,,,,,,,,,,,,,,,,,,,,,,,,,,,,,,,,,,,,,,,,,,,,,,,,,,,,,,,,,,,,,,
Centro IST di ASST Lariana, Centro IST ,"Via Napoleona, 60 Como - CO ", 800896972 ,,, ,08:00,13:00,09:00,09:00,08:00,13:00,08:00,13:00,08:00,09:00,,,Uniti contro l'AIDS,https://www.uniticontrolaids.it/aids-ist/test/dove.aspx, Dati aggiornati al 16/11/2020 ,,,,,,,,,,,,,,,,,,,,,,,,,,,,,,,,,,,,,,,,,,,,,,,,,,,,,,,,,,,,,,,,,,,,,,,,,,,,,,,,,,,,,,,,,,,,,,,,,,,,
PRESIDIO S. ANNA DI COMO - ASST-Lariana, U.O. Patologia Clinica ,"Via Ravona, 4 San Fermo della Battaglia - CO ", 031.5859094 ,,, ,07:30,09:30,07:30,09:30,07:30,09:30,07:30,09:30,07:30,09:30,07:30,09:30,Uniti contro l'AIDS,https://www.uniticontrolaids.it/aids-ist/test/dove.aspx, Dati aggiornati al 04/11/2020 ,,,,,,solo poliambulatorio S.Anna Via Napoleona,,,,,,,,,,,,,,,,,,,,,,,,,,,,,,,,,,,,,,,,,,,,,,,,,,,,,,,,,,,,,,,,,,,,,,,,,,,,,,,,,,,,,,,,,,,,,,
A.S.S.T. DI CREMA," Laboratorio analisi L.go Ugo Dossena, 2 Crema - CR ",, 0373 280243 , 0373 280791 , Dott.ssa Cristina Bonetti , ,09:30,10:00,09:30,10:00,09:30,10:00,09:30,10:00,09:30,10:00,,,Uniti contro l'AIDS,https://www.uniticontrolaids.it/aids-ist/test/dove.aspx, Dati aggiornati al 15/04/2019 ,,,,,,,,,,,,,,,,,,,,,,,,,,,,,,,,,,,,,,,,,,,,,,,,,,,,,,,,,,,,,,,,,,,,,,,,,,,,,,,,,,,,,,,,,,,,,,,,,,,,
ASST-CREMONA, Gruppo C ,"Via San Sebastiano, 14 Cremona - CR ", 03724451755 ,,, ,08:00,16:30,08:00,16:30,08:00,16:30,08:00,16:30,08:00,16:30,,,Uniti contro l'AIDS,https://www.uniticontrolaids.it/aids-ist/test/dove.aspx, Dati aggiornati al 19/10/2020 ,prendere appuntamento telefonico,prendere appuntamento telefonico,prendere appuntamento telefonico,prendere appuntamento telefonico,prendere appuntamento telefonico,,,,,,,,,,,,,,,,,,,,,,,,,,,,,,,,,,,,,,,,,,,,,,,,,,,,,,,,,,,,,,,,,,,,,,,,,,,,,,,,,,,,,,,,,,,,,,,
GRUPPO C, ASST- Cremona Punto Prelievi c/o SERT CREMONA ,"Via San Sebastiano, snc Cremona - CR ", 0372/451755 ,, Dott. Giuseppe Pedrazzani , ,08:30,12:30,08:30,12:30,08:30,12:30,08:30,12:30,08:30,12:30,,,Uniti contro l'AIDS,https://www.uniticontrolaids.it/aids-ist/test/dove.aspx, Dati aggiornati al 05/11/2020 ,15:00,15:00,15:00,15:00,15:00,,16:00,su appuntamento,16:00,su appuntamento,,,16:00,16:00,16:00,su appuntamento,su appuntamento,,,,su appuntamento,,,,,,,,,,,,,,,,,,,,,,,,,,,,,,,,,,,,,,,,,,,,,,,,,,,,,,,,,,,,,,,,,,,,,,,,,,,,,,,
